{
  "contractVersion": "1.0",
  "spaceId": "siglip2-base-p16-224",
  "modelId": "siglip2-base-image",
  "dim": 768,
  "vectorF16": "9x7RpJyjn60lLEUp/6EhJy4hGqWAKLihD6JMpzEkT5sGJZilrBwcqMAn7R4XIpAjqKg3J7wsjKv3q+6qwCe+HPcopybCHzshQZ4AKDSpxaN6ICYsCqf4qDCldyhUoBkqUKwyKcQoiKqoHZkpehqbKHgtDCEqoRqn+CU/n5aewZv8JemoDKubrYUpcBn0KkiN1qZnJKWZx6kTqBEshyKsIxihWqYbKLab/qbxnCyoAB8zKbOnlCompqcdtKcYoPwWAaR5pj6mkKc7q9igZCMvKPYlqC3fITSkTyzTqHYoZqiGIoisJCjUnXWouysNJ8AW3qZklgqerSZaJyamD6XnpDeqc6XPml0mFSpypxMlGKTHLC6XoCRQqHenbh8To4IiMasZJiSo7ytQoQ4pbarnIxeofKRAE9eh3iDjJgMmcppHqmmnNp/jrO0maqChoF4oJyYSIJyouCFgIhOoziiuJImsfhzTqTwpbycVqROogRtmoAYr0yY0oVElrqy1IfsnmJ6LpjYlgyyMHympqCpTrKIkXKVJKNOnGSqIIfSri6zTofYprhzyGFigzCbzIiohiah4KUcq/qlNLagmf6RjrA0mIyV8pR+sLilrpVikjS7mLGQoMqT7JUGt2RsAp+ypSqvWJJQa4h3CJ8unsakXrC2iACeBneglcKlSpA6nwKlILNknBKcOpzeYpKoEJPap06K4qGukIao+q3OoQ6ZvoRUZCCt7J6mgsCZYpqwqECU+qvUmhCcvruSmXaRxrOqoXqisJIkhDC5Do1Apzxn+IFepZqwRpwUnSiuQJZckuqcRKzAq5KTVlpaowip8IwGbfyMPJJSjuKnpqQGsQCQcLdOrGB2SI4moiB8NqYcpeaVpG00m66MgrOWkByc7mjwg+qhHHbUmXxVlLKifzKhzq04pWZipKDckfCvVKfSiDCEAKbGpriqVKYcoZ5+RISWpRRhppWEajqQ6IW4pCKpDKJas+qxmnO8LFCSWq2uYqRzIKaeb3ySAqOmeGqR6Jo6or6dOJR8sDSOXIWCiAyn5JPsrGCJeqECljKjDqdIpcCe0qRosgSBoqB0jGZkep3msaRVhIfCtHCWwJVSkIRwrobanoqI5Kq6qXyDIHoSmDqRzqtmnaBAFIiOoCi9BpbEcP6Bdo/4paaQlKkIp0ajFKP2lTS4bo1WoZqz0qVmlmaipqWemnJ+tKtirFaVlqPqq1aksqJsmJZ/0pKElLCEdoBQjoafHJU0kmKOeqQAr8RoHLwWm2ycApKwgrSddp2Cb7h0uHH4luSiuJ9ggZqI0qcam3qRKJrOiuanFJWanDqcroFwkjq0qqXgetaL2p/2kYSozpJAmSycmpBYkJqSfpS+pByhWoxalMakqLNUm5ZxmpgyrYCFQIXyqWSkmJ26oHqXfo+sdXZ2Mq8oq1CHOKccpqZ9NIskmFycKnrKlMxVipx+lrawqGruoH6XEl8ghWiyIH4Kq0Rx9pVsjUKaGprWkyKU0rCimIZCHKWeh2aJXJfgkXitkJbyRKioLK2Gk0x29q7WiEqjjn3CkHp6Ym4wkQSAtpfCpsCmHKjCkLCUHqzKr+aDHKtKor6dnK1ys9CV+JJmf8x4JLjCpyKFjoFqmLqpWKw4gDKx5pngjbiOiqr2aziA7I0UjM6xBLMcfKSyYLuqdr6n1J6meKKTCqMYrFKRyqh+kVKnRHbqj36iLJe2lqybPKaui9KVYHxsoloYoHe2TvCHKJYGmcqRsFiKmBB3wJGeSj6UppwgsDCgoqb+nUSz2KrkcVSnZqhgD0yZIrDanNic2KXelVyFfKwmjJKqGmD6j/inmHWOnhy2bpFokOiY5J18eZyUBmYmqDaBPn4yeBB3BpRgqNysRrX8Ni6YAro4js6XsogCmASm1KRkhYiYknCod1aYXFZOm3yKfJ7shdCkyLtqsCBA9pTWkQaq+F8Kg1KWvoHalZa32KJehYKilIRqmAa0WKLmrBqBtHDcqeykbHginqaMCKR0sAiXwpb4o6qKDoyShbyUSIZIo+Cm6JF+t0KvYHcWY",
  "kind": "region",
  "regionId": "r7"
}
